{
  "meta": {
    "title": "Why Reliable AI Features Need Small Interfaces",
    "title_zh": "为什么可靠的 AI 功能需要更小的接口",
    "source": "Immersion Reader Demo",
    "url": "",
    "kind": "article",
    "lang": "en",
    "study_card": {
      "word_count": 1280,
      "segment_count": 22,
      "difficulty": "中高",
      "estimated_days": 3,
      "main_practice": "盲听 + 影子跟读 + 工程表达迁移",
      "value_points": [
        "吃透可靠性工程核心词汇: surface area / error budget / graceful degradation",
        "练习把概率系统讲清楚的工程长句",
        "迁移到 design note / PR 描述 / standup 三种工作写作"
      ],
      "suggested_pace": "第 1 天 盲听全文 + 精读 §1-8 · 第 2 天 精读 §9-16 + 影子跟读 · 第 3 天 精读 §17-22 + 完成迁移任务"
    }
  },
  "voice": {
    "engine": "edge",
    "voice": "en-US-AndrewNeural",
    "rate": "-20%",
    "speed": 0.8
  },
  "segments": [
    {
      "id": "seg-01",
      "en": "A reliable AI feature usually starts with a smaller interface than the demo suggests. The demo shows what is possible, but the product interface decides what can be trusted every day. Most teams learn this the hard way: they ship the widest possible surface, watch it break in unexpected hands, and then spend a quarter walking it back. The teams that move fastest are usually the ones that promised the least at the start.",
      "tts": "A reliable A I feature usually starts with a smaller interface than the demo suggests. The demo shows what is possible, but the product interface decides what can be trusted every day. Most teams learn this the hard way: they ship the widest possible surface, watch it break in unexpected hands, and then spend a quarter walking it back. The teams that move fastest are usually the ones that promised the least at the start.",
      "zh": "可靠的 AI 功能，起步时的界面往往比演示暗示的更小。演示展示可能性，产品界面决定什么能每天被信任。多数团队是吃了亏才明白：先把暴露面铺到最大，看着它在意想不到的用法里出问题，再花一个季度往回收。跑得最快的团队，往往是开局承诺最少的那批。",
      "hard": [
        {
          "w": "reliable",
          "type": "word",
          "def": "可靠的;可长期信任的"
        },
        {
          "w": "interface",
          "type": "term",
          "def": "接口;人与系统交互的边界"
        },
        {
          "w": "the hard way",
          "type": "idiom",
          "def": "吃了亏才学会;通过教训"
        }
      ]
    },
    {
      "id": "seg-02",
      "en": "When a tool has a clear constraint, users know how to recover from failure. A fallback is not a sign of weakness; it is part of the contract. If the model cannot answer, say so plainly, and route the user to something deterministic. People forgive a system that fails loudly and predictably. They abandon a system that fails silently, because silent failure turns every future answer into a question.",
      "tts": "When a tool has a clear constraint, users know how to recover from failure. A fallback is not a sign of weakness; it is part of the contract. If the model cannot answer, say so plainly, and route the user to something deterministic. People forgive a system that fails loudly and predictably. They abandon a system that fails silently, because silent failure turns every future answer into a question.",
      "zh": "当工具有清晰约束时，用户知道失败后怎么恢复。兜底不是软弱，而是契约的一部分。模型答不了就直说，并把用户引到一条确定性的路径上。系统大声地、可预期地失败，人们会原谅；悄悄地失败，人们会离开——因为一次无声的失败会让之后每个答案都变成问号。",
      "hard": [
        {
          "w": "constraint",
          "type": "word",
          "def": "约束;限制条件"
        },
        {
          "w": "fallback",
          "type": "term",
          "def": "兜底方案;主路径失败后的备用路径"
        },
        {
          "w": "deterministic",
          "type": "term",
          "def": "确定性的;同输入必同输出"
        }
      ]
    },
    {
      "id": "seg-03",
      "en": "Engineers like to talk about surface area. Every input you accept, every flag you expose, every promise you make in the docs adds to it. A large surface area means a large blast radius: when something goes wrong, more users are standing inside the explosion. Cutting scope is therefore not a product compromise. It is a reliability tool, and often the cheapest one you have.",
      "tts": "Engineers like to talk about surface area. Every input you accept, every flag you expose, every promise you make in the docs adds to it. A large surface area means a large blast radius: when something goes wrong, more users are standing inside the explosion. Cutting scope is therefore not a product compromise. It is a reliability tool, and often the cheapest one you have.",
      "zh": "工程师爱谈暴露面。你接受的每个输入、暴露的每个开关、文档里许下的每个承诺，都在扩大它。暴露面大，波及面就大：出事时，站在爆炸范围里的用户更多。所以砍范围不是产品上的妥协，它是一种可靠性工具，而且常常是你手里最便宜的那个。",
      "hard": [
        {
          "w": "surface area",
          "type": "term",
          "def": "暴露面;系统对外承诺与入口的总和"
        },
        {
          "w": "blast radius",
          "type": "term",
          "def": "故障波及面;出错时受影响的范围"
        },
        {
          "w": "scope",
          "type": "word",
          "def": "范围;边界"
        }
      ]
    },
    {
      "id": "seg-04",
      "en": "AI features are probabilistic by nature. The same prompt can produce a brilliant answer on Monday and a mediocre one on Friday. Traditional software promises determinism: a function returns the same output for the same input. Language models break that promise quietly. The interface is where you decide how much of that uncertainty your users are forced to carry.",
      "tts": "A I features are probabilistic by nature. The same prompt can produce a brilliant answer on Monday and a mediocre one on Friday. Traditional software promises determinism: a function returns the same output for the same input. Language models break that promise quietly. The interface is where you decide how much of that uncertainty your users are forced to carry.",
      "zh": "AI 功能天生是概率性的。同一个 prompt，周一可能给出精彩答案，周五就变平庸。传统软件承诺确定性：同样输入返回同样输出。语言模型悄悄打破了这个承诺。而界面，正是你决定让用户背负多少不确定性的地方。",
      "hard": [
        {
          "w": "probabilistic",
          "type": "term",
          "def": "概率性的;输出带随机性"
        },
        {
          "w": "mediocre",
          "type": "word",
          "def": "平庸的;不好不坏的"
        },
        {
          "w": "determinism",
          "type": "term",
          "def": "确定性;行为完全可预测"
        }
      ]
    },
    {
      "id": "seg-05",
      "en": "A small interface acts like a narrow waist. On one side, the model can change, the prompts can be rewritten, the vendor can be swapped. On the other side, the user keeps a stable set of expectations. This is the same trick that made the internet protocol stack work: keep the middle thin and boring, and let both ends evolve freely.",
      "tts": "A small interface acts like a narrow waist. On one side, the model can change, the prompts can be rewritten, the vendor can be swapped. On the other side, the user keeps a stable set of expectations. This is the same trick that made the internet protocol stack work: keep the middle thin and boring, and let both ends evolve freely.",
      "zh": "小界面就像一个窄腰。一侧，模型可以换、prompt 可以重写、供应商可以替换；另一侧，用户保有一组稳定的预期。这正是互联网协议栈成功的老把戏：把中间做薄、做无聊，让两端自由进化。",
      "hard": [
        {
          "w": "narrow waist",
          "type": "term",
          "def": "窄腰架构;两侧自由演化的薄中间层"
        },
        {
          "w": "vendor",
          "type": "word",
          "def": "供应商"
        },
        {
          "w": "protocol stack",
          "type": "term",
          "def": "协议栈;分层网络协议体系"
        }
      ]
    },
    {
      "id": "seg-06",
      "en": "Borrow the idea of an error budget from site reliability engineering. Decide in advance how often the feature is allowed to be wrong, and what happens when it spends that budget. A summary that is wrong five percent of the time may be acceptable. A billing calculation that is wrong once is not. The acceptable error rate should shape the interface, not the other way around.",
      "tts": "Borrow the idea of an error budget from site reliability engineering. Decide in advance how often the feature is allowed to be wrong, and what happens when it spends that budget. A summary that is wrong five percent of the time may be acceptable. A billing calculation that is wrong once is not. The acceptable error rate should shape the interface, not the other way around.",
      "zh": "从 SRE 借来「错误预算」的概念。提前定好：这个功能允许错多少，预算花完了怎么办。摘要错百分之五也许能接受，计费算错一次就不行。应该由可接受的错误率来塑造界面，而不是反过来。",
      "hard": [
        {
          "w": "error budget",
          "type": "term",
          "def": "错误预算;预先允许的失败配额"
        },
        {
          "w": "site reliability engineering",
          "type": "term",
          "def": "站点可靠性工程(SRE)"
        },
        {
          "w": "billing",
          "type": "word",
          "def": "计费;账务"
        }
      ]
    },
    {
      "id": "seg-07",
      "en": "Design for graceful degradation from day one. When the model times out, show the cached result. When confidence is low, shrink the claim: present three candidate answers instead of one confident answer. When everything fails, fall back to the boring deterministic path that existed before the AI feature did. Users rarely notice graceful degradation, and that is exactly the point.",
      "tts": "Design for graceful degradation from day one. When the model times out, show the cached result. When confidence is low, shrink the claim: present three candidate answers instead of one confident answer. When everything fails, fall back to the boring deterministic path that existed before the A I feature did. Users rarely notice graceful degradation, and that is exactly the point.",
      "zh": "从第一天就为优雅降级做设计。模型超时，就展示缓存结果；置信度低，就收窄说法——给三个候选答案，而不是一个笃定答案；全都失败，就退回到 AI 功能出现之前那条无聊的确定性路径。用户很少注意到优雅降级，而这正是它的意义。",
      "hard": [
        {
          "w": "graceful degradation",
          "type": "term",
          "def": "优雅降级;故障时平滑降低服务等级"
        },
        {
          "w": "cached",
          "type": "term",
          "def": "缓存的;预先存好的"
        },
        {
          "w": "candidate",
          "type": "word",
          "def": "候选的"
        }
      ]
    },
    {
      "id": "seg-08",